subreddit;id;created_utc;permalink;title;selftext;comments
marketing;4clo15;1459357176.0;/r/marketing/comments/4clo15/analytics_the_new_marketing/;Analytics the new marketing?;is analytics future proof?  i am looking in getting ms in marketing, focus on marketing analytics.  i am currently in sales for att and would like to move into their marketing org.  i love tech, love numbers, love vr, etc.   i really want to do product marketing but i want to have some foothold as i strongly believe the future is about big data and numbers.  anyones two cents is appreciated.;"Data or ""Big data"" as some call it will always be important. But even more important is what you do with that data.  SO many companies focus on ""getting data"" that they almost over-data themselves to death...causing a situation where they have so much they cannot even make any actionable decisions off of it.  In my opinion, analytics will always be a factor. The bigger picture is really attributing acquisition. With all of the different outlets out there (websites, landing pages, social media, TV, print, etc.) it is important to be able to see what happened so that you can make strategic decisions and quantify ROI. The more granular you can get the better.  What I would focus on is:  -Learning and understanding analytics  -Learn and understand platforms that businesses use  -Learn and understand KPIs (Key Performance Indicators, which are a set of quantifiable measures that a company or industry uses to gauge or compare performance in terms of meeting their strategic and operational goals. KPIs vary between companies and industries, depending on their priorities or performance criteria.)  Data is important, but understanding what to do with it is key.  Let me know if you have any other questions. Hope this helps.  -Rob#[Describing future patterns with today's big data.](http://flarrio.com/describing-future-patterns-with-todays-big-data/)#There will always be a demand for strong analytics capabilities, and judging by our client base its an increased focus among organizations. As someone who works in analytics at an ad agency I've found that the most important thing is being able to translate data into business objectives/insights.  We've struggled to integrate individuals with a statistics background largely due to their inability to tie the numbers to the business itself and have had much more success with more traditional business professionals who've demonstrated an aptitude for analytics.  If you're looking to set yourself up for success I would look to pursue this line of education.  Be able to understand and work with data, but most importantly be able to tie it back to the organization and clearly communicate learnings from that data.  "
datascience;4cvyph;1459521826.0;/r/datascience/comments/4cvyph/undergrad_classes/;Undergrad Classes;[deleted];"I've been a data scientist for only two years, so my suggestions aren't hard and fast requirements and don't represent the views of all data scientists, but I think it's still valuable advice.   First, I want to say that I think your classes look good. For stats, I think Advanced SAS programming is going to be superfluous (from my experience), though a lot of large companies and government agencies still use it instead of R. If I am interpreting the course correctly, AI is going to be heavy on machine learning content, so I think that will be helpful as well. Parallel computing is an important class to take - I do a lot of parallel calculations, and the reality is that for most problems, the computational answer is not to buy a bigger box; it is to rent more boxes. Knowing how to manage that is a valuable skill.  The other thing I would like to stress is that while there are some classes that you need to take and that you definitely need a lot of math, I only have a BA in math and a BA in economics. While at college, I used most of my electives to get a minor in Russian, and I got my master's in nonprofit leadership. I did not take half the classes you are taking, including differential equations, or a single comp sci course, and my intro to programming was Stata. Your coursework seems important, but I got my first job by showing some visualizations I had done at a previous position and then I learned R on the job in my first month or two.  Missing out on a single class can seem like a big deal, and if you have no math experience, yeah - it's going to be hard to be a data scientist. But your coursework decisions really aren't as life changing as it seems, and not learning something in college doesn't mean that you'll never learn it.#You've done a good job loading up on the technical skills you'll need to be a data scientist! However, I honestly think you need more than that to be a good data scientist.  I came to data science from a Sociology/Poli Sci background (lots of stats, not much advanced math or CS), so I think I have a slightly different angle on this than other people, but the technical work is really only part of the job. It's also largely a matter of business acumen, presentation skills, and being able to understand and scope a project to solve a particular problem. The stats classes will get at some of that a little bit, but you should also consider at least a couple business classes, project management classes, or even domain classes in an area that you find interesting. Context is important!#At a glance, Computational Science (mainly parallel algorithms) does not seem necessary.  You are missing Machine Learning or Data Mining (Maybe as an independent study if your school doesn't offer a course?).  Focus on R and not SAS as most Data Science positions are rooted in open source.    This looks fairly well rounded, but as I am not a Data Science (I just dabble), I don't have any further advice."
bigdata;4c7vuc;1459123563.0;/r/bigdata/comments/4c7vuc/junior_developer_looking_to_get_started/;Junior developer looking to get started.;Hi I'm a junior developer with nothing more than some classes in machine learning and data mining and have started to take the big data university classes online, I'm just wondering advice for getting started out learning about the field out of interest? Any information is appreciated, thanks so much! ;https://blog.treasuredata.com/blog/2016/03/15/self-study-list-for-data-engineers-and-aspiring-data-architects/
environment;4cpq2z;1459426212.0;/r/environment/comments/4cpq2z/how_americas_big_data_centers_are_going_green/;How America’s big data centers are going green. Tech companies could substantially bolster the clean energy market.;;
datascience;4e0dwr;1460185295.0;/r/datascience/comments/4e0dwr/easier_to_work_remotely_as_engineer_than_data/;Easier to work remotely as engineer than data scientist?;[deleted];[deleted]
austinjobs;4drfbm;1460041317.0;/r/austinjobs/comments/4drfbm/hiring_data_scientist/;[HIRING] Data Scientist;"    Data Scientist (SQL / Hadoop)    Northwest Austin Texas    PERM - Direct Hire    Salary is OPEN + equity!      We are working directly and exclusively with the President of this Big Data / Hadoop ecosystem / Data Analytics / ETL software company in its early stages of enterprise database management.  They are simply trying to build a better analytics product! Their platform is cloud hosted, so we will be looking for AWS and/or Azure experience. This is an opportunity for a Data Scientist to be part of something totally different. This ETL Software company is headed to paving the way of doing all things ""data"" their way, and even hold several patents for the data based technology used. If you love data and math this job is for you! In additional to a competitive salary there is equity play and a sound group of investors funding them.    Hiring Manager indicated they were looking for ""A Data Scientist who knows modern data management solutions from the outside-in. Number of years of experience is flexible, but the candidate should have a very high level of proficiency in the skills listed below""    What we are looking for in this Data Scientist:	*Data structures and algorithms experience 	*SQL (for analytics)	*Statistics, machine learning, graph analysis	*Experience using technologies within the Hadoop ecosystem	    PLUSES that would put this Data Scientist on top of the list:	*Spark experience	*Scala or other JVM languages 	*Deploying in AWS, Azure, or other cloud infrastructure	*Streaming analytics and event processing 	*Experience with basic data analysis tools, such as RStudio or Pandas is a plus     Education:	*BS in Computer Science, Mathematics, or related field	*MS or PhD in Computer Science or Mathematics is highly desired.    **Have questions? Contact me directly Suzie Jimenez 512.872.2199 or send me your LINKEDIN profile suzie.jimenez@thehtgroup.com**Algorithms, sql, analytics, statistics, machine learning, hadoop, spark, scala, jvm, aws, azure, cloud, analytics";
bigdata;4daa91;1459760365.0;/r/bigdata/comments/4daa91/processing_big_data_using_15kb/;Processing Big Data using 1.5Kb;;
cscareerquestions;4dwswu;1460128121.0;/r/cscareerquestions/comments/4dwswu/accepted_a_software_engineering_internship_but/;Accepted a software engineering internship, but might have an offer for a full time Data Analyst position. What should I do?;So last week I verbally accepted an offer for a software engineering internship (10 weeks full time, paid, 22/hr).  While waiting for the written offer to arrive, I interviewed at another place for a Data Analyst position and was called back for a second interview next week.  It's full time, and I'm thinking it will pay somewhere in the range of 45-50k + full benefits and 5 weeks paid time off (pretty decent for my area, I'm not in some crazy expensive region like the Bay area or NYC).   I'm thinking that I could be getting an offer from this company, the first interview went well.  I still have one semester of school left after this (graduating in December), and I think the company offering the full time position is willing to work with me for that, as my classes would be mostly at night anyway.I'm conflicted as to what I should do:  on one hand, I have a solid internship lined up for the summer, that pays way better than the job I have currently, and is more in line with what I want to do (I went back to school specifically for programming/software engineering), and I'd have to renege on the offer, but at the same time, a real full time job is hard to turn up.  And, I'm not against a big data type job, I just didn't necessarily see myself in those shoes when I went back to school.  It could be lower stress/pressure than doing a programming type job, which might fit my personality better.  I'm just a little conflicted and was wondering if anyone could provide some insight.;go with which ever job better fits your long term career goals and which job will help you get that next job better.#Just as an aside, if you look at the math, your internship will pay about as much as the full-time (they're close enough that over 10 weeks, the difference is pretty negligible).  And generally speaking companies that transition their interns into full-time also give them a compensation boost.  Just something to consider.#I'd keep the internship and finish out your degree.  Tell the analyst company that you're interested in the position, but you're not able to start until after you graduate.  If they really want you, they'll hold the position.  If not, there will be other offers.
SFBayJobs;4dha6a;1459874785.0;/r/SFBayJobs/comments/4dha6a/hiring_housecanary_is_hiring_for_7_jobs_senior/;[Hiring] HouseCanary is hiring for 7 jobs: Senior Software Engineer, Software Engineer, Web Developer, Project Manager, Automation Engineer, Director of DevOps and Senior QA Engineer. All in San Francisco!;Please [send me a message](https://www.reddit.com/message/compose/?to=jungrothmorton) or leave a comment with any questions you have! Click on any job title get the application page for that job. All jobs are not remote, and require being in the appropriate office during normal hours.At HouseCanary, we're using big data and analytics to predict the future of the real estate market in the US. Our goal is to use this data to help people make better real estate decisions. HouseCanary platforms forecast real estate values at a local level, and every month, we forecast 36 months into the future, and our models predict more than 95% of the variation in price over time.# [Data Engineering | Senior Software Engineer](http://www.housecanary.com/careers/?gh_jid=66545&gh_src=82ai1f)San FranciscoWe're seeking a passionate Senior Software Engineer to help build out the dataaggregation and ingestion platform powering the most accurate real estateanalytics tools in the world.**What you'll do:**  * Ingest large amounts of data from numerous sources  * Develop complex queries to solve data mining problems  * Write reliable and efficient programs scaling to massive datasets and large clusters of machines  * Collaborate with talented data scientists to implement predictive models  * Create optimized ETL jobs to power industry-leading front-end applications**What you have:**  * 5+ years software engineering experience  * Expert level Python ability (or willingness to get there)  * Advanced level SQL knowledge  * Excellent communication skills  * Collaborative and proactive personality  * Ability to work through ambiguity and deal with shifting priorities# [Data Engineering | Software Engineer](http://www.housecanary.com/careers/?gh_jid=66933&gh_src=82ai1f)San FranciscoWe're seeking a passionate Software Engineer to help build out the dataaggregation and ingestion platform powering the most accurate real estateanalytics tools in the world.**What you'll do:**  * Ingest large amounts of data from numerous sources  * Develop complex queries to solve data mining problems  * Write reliable and efficient programs scaling to massive datasets and large clusters of machines  * Collaborate with talented data scientists to implement predictive models  * Create optimized ETL jobs to power industry-leading front-end applications**What you have:**  * 2+ years software engineering experience  * Advanced level Python ability  * Strong SQL knowledge  * Excellent communication skills  * Collaborative and proactive personality  * Ability to work through ambiguity and deal with shifting priorities# [HouseCanary Appraiser | Senior Software Engineer](http://www.housecanary.com/careers/?gh_jid=65914&gh_src=82ai1f)San FranciscoWe're seeking a passionate Senior Software Engineer to help build out ourappraiser integrations team.**What you'll do:**  * Manage and build client API integration  * Work with application and big data services to implement business requirements  * Build RESTful APIs to power our HTML5 and iOS applications  * Design and implement scalable features to support growth**What you have:**  * 5+ Years Software Engineering experience  * Advanced level Python preferred  * Advanced level SQL knowledge  * Excellent communication skills  * Collaborative and proactive personality  * Ability to work through ambiguity and deal with shifting priorities**Bonus points for knowledge of:**  * Django and Django REST framework  * Real estate markets  * Complex client integrations # [Web Developer](http://www.housecanary.com/careers/?gh_jid=184660&gh_src=82ai1f)San FranciscoWe're seeking a passionate Web Developer to join our team to help build andmaintain our corporate site, develop internal tools and assist with marketingcontent.**What you'll do:**  * Own HouseCanary.com and associated microsites  * Use bleeding-edge HTML5 features  * Work with design and marketing to build new pages  * Develop world-class email campaigns  * Build internal performance dashboards   * Push the boundaries of modern web technologies**What you have:**  * Mastery of HTML5 and CSS3  * Javascript skills  * Collaborative and proactive personality  * Experience building HTML emails  * Ability to work through ambiguity and deal with shifting priorities**Bonus points for knowledge of:**  * d3 or SVG  * Databases  * Python  * Experience with AngularJS (or any frontend MVC)# [Project Manager](http://www.housecanary.com/careers/?gh_jid=162192&gh_src=82ai1f)San FranciscoWe're seeking a passionate Project Manager to help manage customer projectsuccess and product lifecycle for our world-class products.**What you'll do:**  * Manage timelines, resource planning, quality and delivery for customer engagements  * Lead software projects across HouseCanary to successful completion  * Collaborate with all groups within HC (Appraiser, Pro, data engineering, product, etc.)  * Generate and maintain project documentation  * Organize and direct planning and implementation of all project activities**What you have:**  * A customer-oriented approach  * Experience managing multiple customer projects simultaneously  * Extensive exposure to guiding enterprise projects into production  * An agile and continuous delivery mindset  * Expert-level knowledge of SDLC  * Ability to work cross-functionally   * High level of attention to detail  * Bachelor's degree# [Automation Engineer](http://www.housecanary.com/careers/?gh_jid=63567&gh_src=82ai1f)San FranciscoWe're seeking a passionate Automation Engineer to join our team to helpenhance our test automation environment.**What you'll do:**  * Scale our automated testing framework for end-to-end, integration, API and mobile  * Help instill a testing culture  * Partner with the engineering team to integrate test suites into the continuous integration system  * Improve code coverage metrics**What you have:**  * Experience with modern testing methodologies (BDD, TDD)  * SaaS application testing expertise  * Strong development skills in Python or JavaScript  * Substantial exposure to Selenium  * Agile mindset**Bonus points for knowledge of:**  * AngularJS/Protractor  * Appium  * BrowserStack  * Calabash  * Jenkins or TeamCity  * Databases# [Director of DevOps](http://www.housecanary.com/careers/?gh_jid=140131&gh_src=82ai1f)San FranciscoWe're seeking a passionate Director of DevOps to help manage the softwarerelease process for our world-class products, implement monitoring solutions,and manage our AWS infrastructure.**What you'll do:**  * Own build and release management practices  * Drive infrastructure strategy and operations  * Lead operations service delivery and support  * Implement systems monitoring solutions  * Ensure application and infrastructure security  * Work with an awesome technology team building unmatched products**What you have:**  * Team leadership experience  * An agile and continuous delivery mindset  * Strong Linux skills (RedHat or Ubuntu)  * Deep understanding of AWS  * Experience with infrastructure automation (Salt, Chef, Puppet or Ansible)  * Versed in continuous integration tools (TeamCity, Jenkins, etc.)  * Substantial knowledge of SCM (SVN, Git, Perforce, Mercurial, etc.)  * Experience with application server frameworks, and web servers (Rails, Django, Nginx, Apache HTTP, Flask, etc)  * Monitoring tools expertise (pingdom, nagios, icinga, sensu)  * Relational database mastery (MySQL, PostgreSQL)**Extra credit for:**  * Performance management   * Capacity planning  * Internal office infrastructure experience  * Fantastic sense of humor# [Senior QA Engineer](http://www.housecanary.com/careers/?gh_jid=94664&gh_src=82ai1f)San FranciscoWe're seeking a passionate Senior QA Engineer to help ensure the highest-quality software releases in the industry.**What you'll do:**  * Become an authority on our products  * Perform integration testing with partners  * Test incoming data from partners to ensure accuracy and completeness  * Assist with automated regression testing  * Manage story acceptance testing  * Manually test all components of our apps**What you have:**  * An agile and continuous delivery mindset  * Experience testing web and mobile apps  * Knowledge of relevant tools (Cucumber, Jasmine, etc.)  * Pragmatic attitude and eye for quality  * Experience building test plans  * Excellent soft skills**Extra credit for:**  * Programming experience (Python/JavaScript)  * Previous use of Selenium  * Some understanding of SQL   * Fantastic sense of humor;
datascience;4ehyda;1460492018.0;/r/datascience/comments/4ehyda/question_about_data_frames/;question about data frames;I script all the time in R and Python and was wondering how data frames compare to other data types memory and processing wise. Is the resources need for them higher? Are they slower to iterate through? And would you use them for very big data sets. The biggest data frame I probably ever used was 100mb. When you get to gbs or tbs are they still viable? ;Data frames in R are essentially lists of vectors.  The vectors (one for each column) can all be different types.  R will iterate (including using the apply commands) much more quickly through matrices than through data frames.  A matrix contains data all of the same type, and so the processing overhead is lower.  I regularly use R with multi GB data frames (50 GB +), and it works fine.  Although I would recommend you use the data.table package instead, as it's much more efficient in aggregating larger data sets.  I may be wrong, but I'd be surprised if vanilla R would cope with a TB data frame.  Even if you have the memory on your server, I would expect the performance to be poor.  R is still not good at utilising more than one core of a processor.  Certain packages use Java or multi-threaded BLAS libraries to use multiple cores, and Microsoft R uses a multi threaded BLAS library for matrix operations (although I tried it, and I'm not sold on the performance).  But in the main, operations are single threaded - not ideal for processing significant quantities of data.  I love R.  But it's important to use the right tools for the right job.  If you're processing multi TB datasets, you should probably use something else.
homelab;4cnab4;1459378640.0;/r/homelab/comments/4cnab4/can_i_make_a_ghetto_database_server_from_a/;Can I make a ghetto database server from a raspberry pi?;[deleted];If she has a computer of her own, any computer, she can install it there? I've run MySQL on my Windows desktop just to do some playing around at work before.   Don't need something seperate tbh.#I agree with @Matt on this one, a type 2 hypervisor is the way to go here (VirtualBox/Client Hyper-V/VMW Workstation...).  Speaking as someone who runs about a dozen Pis between work & home, I imagine any dbms is going to run really poorly on a Pi when you start throwing in the kind of data required for big data analysis.#Why not run it on her laptop? SQLExpress, MySQL, Oracle.
technews;4eb2x8;1460387163.0;/r/technews/comments/4eb2x8/how_big_data_harms_poor_communities/;How Big Data Harms Poor Communities;;
forhire;4e5l4o;1460290412.0;/r/forhire/comments/4e5l4o/for_hire_developer_web_desktop_mobile_and_data/;[FOR HIRE] Developer (web, desktop, mobile) and Data Analyst;[removed];Sorry /u/la_formula_ninguna, your submission has been automatically removed.  /r/ForHire doesn't allow accounts  that are either newer than 10 days (regardless of karma) or are old but have less than 50 karma, or both new and karma-less, to post [For Hire] posts. Earning karma means getting upvotes on posted links (not text posts) and comments. Please do not contact mods for an exception.    *I am a bot, and this action was performed automatically. Please [contact the moderators of this subreddit](/message/compose/?to=/r/forhire) if you have any questions or concerns.*
forhire;4drfon;1460041442.0;/r/forhire/comments/4drfon/for_hire_senior_network_engineer_security/;[For Hire] Senior Network Engineer, Security Engineer/Analyst;CCNP, CCSA, GSECI'm located in North East Ohio, with 18+ years experience in Networking and Security. I'd like to find something remote if possible, since I have 10+ years experience working from home. If not, a 35 minute commute would be tolerable. I'm currently working for a big data firm.Skills: Checkpoint/Cisco firewall administration, IDS/IPS deployment and tuning, Vulnerability assessments/management, SIEM architecture, deployment and analysis, network performance planning, Hadoop data center engineering, Continuous monitoring, Vulnerability remediation, and others.Experience includes: Cisco, Arista, Checkpoint, Tenable Log Correlation Engine/Passive Vulnerability Scanner/Nessus/Security Center CV, Bro IDS, Suricata IDS, Squid, Splunk, Jira/Confluence, Start up firms, Exposure to Agile/Scrum, and others.PM me for a resume.;
tipofmytongue;4dlj7r;1459946099.0;/r/tipofmytongue/comments/4dlj7r/tomtvideo_future_documentary_about_big_data_and/;[TOMT][video] Future documentary about big data and how it could affect our daily lives.;"It's been some years when I saw this documentation but I can't remember which year I saw it nor when it was created.I remember a scene about someone ordering a pizza via phone and they have his whole medical history and say something along the lines of ""your health insurance record shows that your cholesterol level is to high. Are you sure you want extra cheese? That would increase your health insurance fee"" and it goes on and on about how we get enslaved by big data.As far as I can remember the whole thing was animated, no human actors. I remember it to be very blue-ish and ""tron like"". By that I mean futuristic and everything drawn/animated with simple lines.Unfortunately I can't remember any more details :( Does someone have an idea?Thanks in advance!";The Human Face of Big Data?  http://www.imdb.com/title/tt3312100/#Wow, I remembered that bit! I don't know who originally created it, but it was [reposted to YouTube here.](https://www.youtube.com/watch?v=RNJl9EEcsoE) Maybe someone else can find the original content creator?
