subreddit;id;created_utc;permalink;title;selftext;comments
askphilosophy;5hcro6;1481273134.0;/r/askphilosophy/comments/5hcro6/big_data_future_scenarios/;Big Data: future scenarios;What are the worst case scenarios regarding Big Data in the future? With all of our information managed by governments and companies which will be the implications for us, are we giving up our privacy? Why do we want privacy if we are not doing anything wrong?;"information has value. is  information only of tactical value in a modern society because of morality, shame, and guilt? what if we didn’t feel bad when information about us leaked to people. would privacy be an issue in a completely moral society? is there morality in secrets? in the things that we don’t do? i understand the impulse of the individual to be private, at least in a logical sense. if we were all to develop identical perceptions of a strict set of norms, a desire to conscientiously, diligently, punctiliously, and zealously enforce and individually follow them, perhaps. And you know, it is possible that happens in the future. I mean think of how far we have come in that direction. We were once disparate groups of primates wandering the world, forming their own norms and perceptions of the world, with no communication. I imagine, with such isolation, things got weird. like really weird.imagine being in the early holocene. you are some kind of intelligent hominid that is just deciding,"" you know what, this year, we should probably have more vegetables. it’s getting harder to find enough meat to feed this many people, and we’re no longer just competing with the animals, we are competing against those folks in the next valley who try to kill us every time they see us. maybe it would be better if we figured out how to grow those edible plants nearer to us, so we don’t run into them as often, and it is easier to feed ourselves. it doesn’t have to be that organized, but as long as there are trees and edible plants somewhere we can defend and protect it easily,  we could probably manage.”  then, at some point, populations became bigger, territory expanded, different norms came into contact with each other, and boom, here we are today, with a global society that cannot agree on most things. are any of us truly moral? hard to say, probably not. I mean there are definitely some good people out there who have never done anything wrong, but they are a vast minority. for the rest of us, sharing all of our information doesn’t look as harmless. I would rather not have everyone know what I do, regardless of whether or not it is good or bad, what I do on my own time is my own. It is not for other people. Giving that solitude up means that my actions would probably be hindered by fears of social punishment or ostracism   by others. there would be nowhere to be weird anymore, and honestly, most progress comes from someone or a group of people bucking norms and saying “Hey, I know I/We/This idea is weird and different, but you should check us/it out. we might be onto something here”. what if that kind of ingenuity and intellectual and social progress was stifled? we would probably stagnate as a race, and we would never have a chance of reaching that world of no evil. so why do we want privacy? because doing wrong things (not evil things, but wrong things) can be very good, even if the world isn’t ready for them. things like big data can be amazing- but if used to surveil and monitor a population to the point where privacy is nonexistent, and all information is public to some degree, then it could be the most dangerous weapon on earth, because it could quash the weird, or the misunderstood, and halt all human progress indefinitely, or, in a nightmare scenario, could be used by someone evil to accomplish evil ends."
stocks;5j0tzz;1482077159.0;/r/stocks/comments/5j0tzz/discussion_reliq_health_technologies_cverht/;[Discussion] Reliq Health Technologies (CVE:RHT);[deleted];So is it basically a more inclusive Zocdoc?
SJSU;5i6mju;1481667443.0;/r/SJSU/comments/5i6mju/opinions_on_the_big_data_certificate_offered_by/;Opinions on the big data Certificate offered by the School of Information?;[removed];
rutgers;5jnxtt;1482371902.0;/r/rutgers/comments/5jnxtt/difficulty_of_economic_forecasting_and_big_data/;Difficulty of Economic Forecasting and Big Data (Landon-Lane)?;[deleted];
PoliticalVideo;5gpue4;1480986070.0;/r/PoliticalVideo/comments/5gpue4/the_power_of_big_data_and_psychographics_keynote/;The Power of Big Data and Psychographics. Keynote of Alexander Nix from Cambridge Analytica - the company behind Brexit and Trump's campaign.;;See articles and links compiled in this thread  https://twitter.com/gracelynhigdon/status/805404849173131264#This video was 11 minutes and now it's only 52 seconds.  Where's the original?#I'm a bot, *bleep*, *bloop*. Someone has linked to this thread from another place on reddit:  - [/r/politicalvideo] [This video was clipped from 10:00 to 52 seconds, apparently just last week. Does anyone have a mirror?](https://np.reddit.com/r/PoliticalVideo/comments/62lf8h/this_video_was_clipped_from_1000_to_52_seconds/)  [](#footer)*^(If you follow any of the above links, please respect the rules of reddit and don't vote in the other threads.) ^\([Info](/r/TotesMessenger) ^/ ^[Contact](/message/compose?to=/r/TotesMessenger))*  [](#bot)
Bitcoin;5gz7ca;1481106565.0;/r/Bitcoin/comments/5gz7ca/chinas_jingdong_to_build_big_data_ecosystem_using/;China’s JingDong to Build Big Data Ecosystem using Blockchain Technology;;
dataisbeautiful;5hg4rz;1481315610.0;/r/dataisbeautiful/comments/5hg4rz/hadoop_training_online_big_data_certification/;Hadoop Training Online, Big Data Certification Course in New York;;
explainlikeimfive;5h25l5;1481141073.0;/r/explainlikeimfive/comments/5h25l5/eli5_has_a_picture_on_the_mainstream_internet/;"ELI5: Has a picture on the ""mainstream"" Internet ever been lost?";[removed];Your submission has been removed for the following reason(s):  ELI5 is for questions with objective explanations.  Straightforward answers or facts - ELI5 is for requesting an explanation of a concept, not a simple straightforward answer   * Recommended subreddit(s): /r/answers  ---  *Please refer to our [detailed rules](http://www.reddit.com/r/explainlikeimfive/about/rules)*.#Yes, tons of data has been irretrievably lost before, and that certainly includes some pictures. Here's an article about a few cases:  https://www.r1soft.com/blog/6-notorious-cases-of-data-loss-all-hosting-providers-can-learn-from  If a picture or other piece of data is on the public web so that anyone can access it, and any search engine can crawl it, the chances of it being lost forever go way down. The more popular it is, the chances go almost to zero. I know lots of people who accidentally deleted data and recovered it thanks to Google's cache or archive.org.  If the data is private, though, then it's quite possible for it to be lost. #I can't see how it could happen. Big companies have their data backed up in multiple locations to prevent just that from happening
politics;5ggnyi;1480874465.0;/r/politics/comments/5ggnyi/the_power_of_big_data_and_psychographics/;The Power of Big Data and Psychographics;; As a reminder, this subreddit [is for civil discussion.](https://www.reddit.com/r/politics/wiki/rulesandregs#wiki_please_be_civil)  * Do not call other users trolls, morons, children, or anything else clever you may think of. [Personal attacks, whether explicit or implicit, are not permitted.](https://www.reddit.com/r/politics/wiki/rulesandregs#wiki_no_personal_attacks)  * Do not accuse other users of being shills. If you believe that a user is a shill, the proper conduct is to report the user or send us a modmail.  * In general, don't be a jerk. Don't bait people, don't use hate speech, etc. Attack ideas, not users.  * Do not downvote comments because you disagree with them, and be willing to upvote quality comments whether you agree with the opinions held or not.  Incivility results in escalating bans from the subreddit. If you see uncivil comments, please report them and do not reply with incivility of your own.  ***   *I am a bot, and this action was performed automatically. Please [contact the moderators of this subreddit](/message/compose/?to=/r/politics) if you have any questions or concerns.*#Fun Fact: Cambridge Analytica has worked for the Trump and Brexit campaigns too  [https://en.wikipedia.org/wiki/Cambridge_Analytica](https://en.wikipedia.org/wiki/Cambridge_Analytica)#Not a fan of videos: what are 'psychographics'?#Hi `theArkotect`. Thank you for participating in /r/Politics. However, [your submission](https://www.reddit.com/r/politics/comments/5ggnyi/the_power_of_big_data_and_psychographics/) has been removed for the following reason(s):  * [Off-Topic](http://www.reddit.com/r/politics/wiki/rulesandregs#wiki_the_.2Fr.2Fpolitics_on_topic_statement): All submissions to /r/politics need to be explicitly about **current US politics**.  * Non-political news should be posted to /r/news or to a state- or city-specific subreddit     If you have any questions about this removal, please feel free to [message the moderators.](https://www.reddit.com/message/compose?to=/r/politics&subject=Question regarding the removal of this submission by /u/theArkotect&message=I have a question regarding the removal of this [submission.](https://www.reddit.com/r/politics/comments/5ggnyi/the_power_of_big_data_and_psychographics/?context=10000\))
politics;5gfoxr;1480862590.0;/r/politics/comments/5gfoxr/big_data_helped_trump_even_after_he_scorned_it/;Big data helped Trump even after he scorned it;[deleted]; As a reminder, this subreddit [is for civil discussion.](https://www.reddit.com/r/politics/wiki/rulesandregs#wiki_please_be_civil)  * Do not call other users trolls, morons, children, or anything else clever you may think of. [Personal attacks, whether explicit or implicit, are not permitted.](https://www.reddit.com/r/politics/wiki/rulesandregs#wiki_no_personal_attacks)  * Do not accuse other users of being shills. If you believe that a user is a shill, the proper conduct is to report the user or send us a modmail.  * In general, don't be a jerk. Don't bait people, don't use hate speech, etc. Attack ideas, not users.  * Do not downvote comments because you disagree with them, and be willing to upvote quality comments whether you agree with the opinions held or not.  Incivility results in escalating bans from the subreddit. If you see uncivil comments, please report them and do not reply with incivility of your own.  ***   *I am a bot, and this action was performed automatically. Please [contact the moderators of this subreddit](/message/compose/?to=/r/politics) if you have any questions or concerns.*
longtext;5ij3bp;1481825884.0;/r/longtext/comments/5ij3bp/big_data_are_reducing_homicides_in_cities_across/;Big Data Are Reducing Homicides in Cities across the Americas;;
IndieDev;5ii12y;1481814948.0;/r/IndieDev/comments/5ii12y/big_data_analytics_offers_the_possibility_of/;Big Data Analytics offers the possibility of understanding the pattern of engaged users for mobile application owner or marketer;;
OnePieceTC;5gw7gf;1481065594.0;/r/OnePieceTC/comments/5gw7gf/do_u_have_to_always_download_the_big_1gb_data/;Do u have to always download the big 1GB data?;[removed];If you're rerolling, you probably want to reroll after your initial rare recruit if it's not a good starter. Definitely don't go through the doom tap if your first roll is garbage.#There's an easier way to do it in the rerolling guide but requires a few things.
datascience;5i31cr;1481627432.0;/r/datascience/comments/5i31cr/hi_guys_id_like_to_hear_your_feedback_on_a/;Hi guys, I'd like to hear your feedback on a potential book cover for a book that I'm writing. Please let me know which option you like, or feel free to offer alternatives. Thanks for helping;The Money is in the Data: An Entry-Level Introduction to Big DataData Literacy: An Introduction to Big DataDon't be Scared by Data Science: An Introduction to Big DataA Gentle Introduction to Big DataHarnessing Big Data: A Simple Introduction;Will the book feature a section on how to best obtain results via survey?  
datascience;5guqag;1481051087.0;/r/datascience/comments/5guqag/anomaly_detection_using_h2o_deep_learning_dzone/;Anomaly Detection Using H2O Deep Learning - DZone Big Data;;
datascience;5ggzct;1480877854.0;/r/datascience/comments/5ggzct/cep_patterns_for_stream_analytics_dzone_big_data/;CEP Patterns for Stream Analytics - DZone Big Data;;
SuggestALaptop;5jge12;1482274540.0;/r/SuggestALaptop/comments/5jge12/looking_for_a_laptop_similar_to_the_asus_k501uq/;Looking for a laptop similar to the ASUS K501UQ for data science programming and possibly gaming;"I recently bought an ASUS K501UQ off Amazon since there was a deal on it where it was ~€900 (roughly 150-200) cheaper than any other shop I'd looked it up in. However the courier mishandled the package and it arrived damaged, so I'm getting my money back, but they have no others in stock to send me. So I'm looking for an alternative to it. It had the exact same specs as [this](http://www.pcworld.ie/product/asus-k501uq-156-laptop-grey/332174/396.0.0) model.* **Total budget and country of purchase:** Ireland, €800-€900* **Do you prefer a 2 in 1 form factor, good battery life or best specifications to your requirements for the money? Pick or include any that apply.** I already have a surface pro 4, so no need for the 2 in 1. I'd like as good as battery life as I can get while not compromising on the specs.* **How important is weight to you?**It's not crucial, but I also don't want to be carrying a brick around.* **Which OS do you require? Windows, Linux, Mac.**Windows, but will probably install Linux on it at some point too.* **Do you have a preferred screen size? If indifferent, put N/A.** 15.6"" preferably* **Are you doing any CAD/video editing/photo editing/gaming? List which programs/games you desire to run. If you have no requirements, put N/A.** I am a graduate data scientist, so mostly I would like to use this laptop for programming and development. Would be running big data tools such as Hadoop, Spark, Kafka, Zookeeper etc, along with programming IDEs such as Intellij, Eclipse and RStudio. I would like to be able to game with it, since I kind of assumed a laptop capable of running those big data tools such be able to handle the processing power needed for gaming. So while a dedicated graphics card is not essential, it would be preferred. Only photo editing software I'd be running would be GIMP.* **If you're gaming (leave blank if you put N/A above...), do you have certain games you want to play? At what settings and FPS do you want?** Games like Portal, Arkham Batman games, Far Cry etc. I'm not an avid PC gamer, so what ever the best settings/FPS I can get, I'll take.* **Any specific requirements such as good keyboard, reliable business grade build quality, touch-screen, finger-print reader, optical drive or good input devices (keyboard/touchpad)?**  Will need a good processor (i5 or i7), and at least 8GB of RAM (would like one that can be upgraded if 8 is what it comes with). Would also like it to have an SSD. * **Leave any finishing thoughts here that you may feel are necessary and beneficial to the discussion.**I think I've pretty much covered what I will be doing with it, so I'll leave it up to your suggestions.";
copypasta;5g1cwi;1480653110.0;/r/copypasta/comments/5g1cwi/the_highestvoted_questions_from_each_stack/;The highest-voted questions from each Stack Exchange site, sorted by site name;[deleted];"How do I give 3D-printed parts in PLA a shiny smooth finish? How should I deal with discouragement as a graduate student? Could a paradox kill an AI? Do different beer glass shapes really make a difference in taste? How do I root my Android device? What differentiates anime from regular cartoons? Got any tips or tricks for Terminal in Mac OS X? Can I program for Arduino without having a real board? How do I keep my smart lightbulb from telling its manufacturer every time I leave the house? How loud would the Sun be? What is the dark spot visible below the cockpit on A-10s? Why ride a fixed-gear bike? Why do I only breathe out of one nostril? What is a good way to concisely explain Bitcoin? Can Blender render pngs with the background transparent? How can I beat ""Big Money"" in Dominion? How much usage can a LEGO piece take before it loses its ""clutch power""? Can the Buddha ever be a woman? Why is gold golden? When is castling possible? Is there a lot of value in learning to write Chinese characters? Can I belive in evolution and still be a Christian? How is CiviCRM different in Drupal, Joomla, and WordPress? Most creative way to display 42? which is better to avoid? How can I figure out how much caffeine is in my cup? How is it that taking a break from a problem sometimes allows you to figure out the answer? Why do Internet forums tend to prohibit responsing to inactive threads? How is Gaussian Blur Implemented? How can I chop onions without crying? What's the best practice for handling data migration and organization across development environments? How to cut a tiny circle in paper? Should we MAC-then-encrypt or encrypt-then-MAC? Why is quicksort better than other sorting algorithms in practice? What's new in purely functional data structures since Okasaki? How big is big data? How do I list all databases and tables using psql? What is the purpose of these holes on my wire stripper? What are the recommended directory permissions? ""River"" detection in text? impossible or improbable? Is there any software that facilitates scanning of a paper book into an ebook? How will non-rich citizens make a living if jobs keep getting replaced by robots and are outsourced? What is it that strips vocals from audio when a 1/8"" audio jack is partially unplugged? One of my apps has a second, fuzzy icon in Plank. How can I workaround this? How does the ""Dalai Lama walks into a pizza shop..."" joke work? What are the practical differences between the various Emacs Package Repositories? Why do glass windows still exist? How do you quote a passage that has used ""[sic]"" mistakenly? ¿Por qué mis programas no pueden hacer cálculos aritméticos correctamente? Does Esperanto have a gender-neutral pronoun that can be used for humans? Why does Ethereum plan to move to Proof of Stake? How important is knowing German in Germany? List of Resources for EE developers and users? Is it healthy to exercise a muscle when it's still sore? How do I get my first job at a freelancing site? Pourquoi place-t-on une espace avant les ponctuations fortes ? How can I effectively manage a hobby game project? How can I tell if a corpse is safe to eat? Can weeds be put into compost, or will they grow again when the compost is used? Should I use the modern (what it is called now) or historical (what it was called) place name? How can I better learn noun genders? Measuring accuracy of latitude and longitude? What is wrong with Comic Sans? Why is Morse Code still in use? Keyboard for programmers? How can I protect my eyesight when using computers? ""A god"" or ""God"" in John 1:1? Why do Hindus believe in cremation instead of burial? Why did Hitler attack the Soviet Union when he was still busy fighting the United Kingdom? What equipment do I need to buy to start making beer? What famous theorems or results were proven by female mathematicians? Is evolution compatible with Islam? Can I say bravo to a female performer? ２次元配列は不連続か? What's the difference between は and が? What is the proper way to make an AJAX call in component? Does ""reputation scoring"" make ""the Torah a crown to magnify yourself with""? Is there an easy way to tell whether any given Korean name is typically male or female? Are there any studies which address the effectiveness of studying multiple related languages simultaneously? Are ""-que"" and ""et"" equivalent? Why are lawyers typically excluded from juries? How can I keep my cat off my keyboard? What characteristics are unique to English (or at least rare among language as a whole)? Security Patch SUPEE-7405 - possible problems? How do you prepare for the stress of a real-life defense situation? Can I use my powers for good? What female mathematician can I introduce to my High School students? Where can I find examples of good Mathematica programming practice? Polynomial bijection from ℚ×ℚ to ℚ? Why is plexiglass not used for car windows? Could we please be a bit nicer to new users? How does Monero privacy and security compare to Zcash? Best way to start investing, for a young person just starting their career? What caused and ended the time loop in Groundhog Day? Why do minor keys sound ""sad""? What does it mean for an album to be remastered? When and how did the Greek mythos transfer to the Romans? Why do we need a 3-way handshake? Why not just 2-way? A database of open databases? How to contribute to Open Source as a non-programmer? What is the most efficient food to take for a 12-15 day hiking trip? What to do with my pre-teen daughter who has been out of control since a severe accident? How to torpedo a bad patent my former large employer is filing? Why does my cat keep patting my face? Was mathematics invented or discovered? Good examples of RAW's advantages over JPEG? Can I compute the mass of a coun based on the sound of its fall? Why use story points instead of hours for estimating? How to deal with people who randomly go all-in? Why were pre-election polls and forecast models so wrong about Donald Trump? Como usar corretamente ""por que, por quê, porque ou porquê""? How do I get myself out of bed in the morning? Como fazer hash de senhas de forma segura? Is this Tetris puzzle solvable? What data sources are available online? Is the Raspberry Pi suitable for running continuously, 24/7? How can tilting a N64 cartridge cause such subtle glitches? Is there any disassembler to rival IDA Pro? Why are Mars rovers so slow? How do I get my PCs to not be a bunch of murderous cretins? Для чего нужны свойства? Чайник остывает или не остывает? Why does ""охуенно"" mean ""great"" but ""хуёвый"" mean ""bad""? End of javascript sidebar workarounds? Recommendations for a usable, fast C++ matrix library? Would the One Ring even work for anyone but Sauron? Short complex password, or long dictionary passphrase? Our security auditor is an idiot. How do I give him the information he wants? Are SharePoint certifications worthwhile? What are some appropriate uses for Sitecore Data Providers? Does torture work well as an interrogation technique? What technical details should a programmer of a web application consider before making the site public? What is a good newbie friendly graphical Git client for Windows? I want to learn how to make electronic music. Where do I start? Can I borrow a lunar rover? How important are accents in written Spanish? Points are given in tennis 15-30-40. Why 40? 1.5 Million lines of code. 0 tests. Where should we start? ""View Vote totals"" without 1000 rep? Why is it faster to process a sorted array than an unsorted array? Better to learn programming, or hire a programmer? statistics vs. machine learning? Why does Windows think that my wireless keyboard is a toaster? Why shouldn't meat be placed in my compost pile? When should I use \input vs. \include? Can I exit from a specific country or node? OK we're all adults here, so really, how on earth should I use a squat toilet? How to design a recursive menu schema? How to list all installed packages? What is the exact difference between aa ""terminal"", a ""shell"", a ""tty"" and a ""console""? Should ""Yes, delete it"" be red, or green? How can I copy text to the system clipboard from Vim? How can I crop a video with ffmpeg? Alternatives for Google Reader (with Android synchronizing)? Recovering a lost website with no backup? How do I take a screenshot on a Windows Phone device? How do I prevent dangerous kickback on a table saw? When should you use WP_Query vs query_posts() vs get_posts()? How should I deal with an employee who has slept with my wife? Tomorrow is Groundhog Day... For everyone. How does society respond? Is there a special software for writers?"
btc;5h6feh;1481196403.0;/r/btc/comments/5h6feh/how_bitcoin_artificial_intelligenceai_big_data/;How Bitcoin, Artificial Intelligence(AI) & Big Data are Converging in Kenya, East Africa.;;
korea;5jpky2;1482396226.0;/r/korea/comments/5jpky2/networking_with_people_in_the_ai_startup_scene/;Networking with people in the AI startup scene;Hi r/korea!I'm working in artificial intelligence (not really big data but related to it) here in Korea and would like to meet and talk to people who have similar interests. Preferably entrepreneurs or people in the startup scene.Any advice on how I could go about it?;Send me a private note#Hey! There's the largest startup conference in Korea happening soon! You might wanna check it out : http://www.techforkorea.com/2017/04/30/koreas-largest-startup-conference-gsc-2017spring-to-be-held-on-may-23th-at-coex/  you can also check out some facebook groups. good luck! 
bigdata;5hsq1j;1481493841.0;/r/bigdata/comments/5hsq1j/all_about_big_data_analytics_tools_how_to_measure/;All About Big Data Analytics Tools: How to Measure Your Goals;;
bigdata;5gshjr;1481025942.0;/r/bigdata/comments/5gshjr/big_data_nightmares/;Big Data Nightmares;;
bigdata;5g1l7j;1480656284.0;/r/bigdata/comments/5g1l7j/7_tools_for_successful_big_data_analytics/;7 Tools for Successful Big Data Analytics;;
