subreddit;id;created_utc;permalink;title;selftext;comments
badlinguistics;5hys2e;1481572275.0;/r/badlinguistics/comments/5hys2e/a_finnish_politician_wants_to_reform_finnish/;A Finnish politician wants to reform Finnish grammar in order to make it easier for computers to understand;[deleted];"[deleted]#>The great majority of human thought happens outside of Finland  Citation needed. #The real badlinguistics was blocking many linguists who were pointing out his mistakes. And many people who dared to ""like"" their comments. And then acting smug about it.  The real badhistory, on the other hand, was saying ""this is what they said to Galileo when he claimed the Earth was round"".#[deleted]#I know it's pedantic but...   > Suomenkieli on minulle rakas. 'Finnishlanguage is dear to me.'  Is it? Is it really Mikael?#Junger saga continues [here](https://scontent-frt3-1.xx.fbcdn.net/v/t1.0-9/15355678_10154639243620482_7043793509279750455_n.jpg?oh=4f1972cd2ff6d60b7c4b80db3b3bff7f&oe=58B0E34D)  Translation: Well look at that. According to wikipedia language complexity is something that is not very well researched, because it is politically incorrect. Thats why many researchers are afraid to study it.  Tell me about it. I think I just found a modern taboo.  Facebook <3  #in other words ""a politician doesn't understand linguistics nor nlp""#mötkö vai lötkö?#The problem with translating Finnish comes from words with multiple meanings, like kuusi (idk how to spell it) which, if I remember what my Finnish friend said correctly, means ""your moon"", ""six"", and ""pine tree"".#With regards to making the computer understand the language better... there _is_ a thing called [lojban](https://mw.lojban.org/papri/Lojban). :P#At least the last point is not badling, but some bold policy (the first part ; the second is simply good policy)   Well, the rest: meh, but what would you expect, if something made it to this sub? "
IAmA;5h0687;1481121100.0;/r/IAmA/comments/5h0687/iama_data_science_professor_at_the_university_of/;IamA Data Science Professor at the University of Michigan, let’s discuss ethics surrounding privacy, data sharing and algorithmic decision-making. AMA!;**My short bio:** I am a Bernard A Galler Collegiate Professor of Electrical Engineering and Computer Science at the University of Michigan. My research spans many aspects of Big Data and Data Science and I have contributed to [Slate Magazine](http://www.slate.com/articles/technology/future_tense/2015/11/using_data_science_for_predictive_policing_has_serious_civil_liberties_drawbacks.html), [U.S. News and World Report](http://www.usnews.com/news/articles/2016-02-24/passwords-privacy-and-protection-can-apple-meet-fbis-demand-without-creating-a-backdoor), [the Conversation U.S.](https://theconversation.com/big-data-analyses-depend-on-starting-with-clean-data-points-43687) I author my own blog, [Big Data Dialog](http://www.bigdatadialog.com/), where I discuss key issues surrounding ethics in data science. My Massive Open Online Course (MOOC) [Data Science Ethics](https://www.edx.org/course/data-science-ethics-michiganx-ds101x-1?utm_campaign=michiganx&utm_medium=partner-marketing&utm_source=social&utm_content=reddit-ama-dec-16) will re-launch on edX in January.**My Course:** [https://www.edx.org/course/data-science-ethics-michiganx-ds101x-1](https://www.edx.org/course/data-science-ethics-michiganx-ds101x-1?utm_campaign=michiganx&utm_medium=partner-marketing&utm_source=social&utm_content=reddit-ama-dec-16)**My Proof:** [http://imgur.com/a/UPHhY](http://imgur.com/a/UPHhY) and [bigdatadialog.com](http://www.bigdatadialog.com);"What would you like to see from Academia In Computer Science programs in relation to ethics *and* security issues going forward? My experience at MIT was that it was largely the veterans (older professors) who had any sort of consideration for the larger societal issues and repercussions of 'big data'. Yes, we did have RMS in the building, so had an active voice advising the larger MIT community :) That said, the younger and/or students didn't seem to care as much - they just wanted data, data and more data, damn the repercussions. I worry that as our veterans retire, the absence of their voice will affect big data's future.  As an aside, a great quote shared with me once was that ""Data is Risk and the more data you collect, the more Risk you expose yourself too"". In that vein, I hope that someday, our corporations may decide that our personal data costs more to protect than it provides in profit. Unfortunately, I also think that personal data is the new currency and big data collections can only get worse. Thoughts?#What problems/solutions do you see with current releases of anonymized big data sets that might end up not being so anonymous in the future? I'm thinking specifically of the Massachusetts health dataset that was released in anonymized but was later found to be quite identifiable.  Thanks for the AMA!#I'm a student at MSU. Care to make fun of our football team?#JT Barrett. 4th and 1. He totally didn't make it, right?#What should I, as a private citizen, know about how my data is being used that I don't?#What data would you want/need from Jim Harbaugh's time at Stanford, The 49ers and Michigan to prove Jed York totally screwed up?   #Thank you for submitting your questions. This ends the live portion of the IAmA, but I will continue to reply to your questions as best I can as they come through. Please keep in mind the Data Scientist's code of ethics: Do not surprise  AND Own the outcomes#Users, please be wary of proof. You are welcome to ask for more proof if you find it insufficient.   OP, if you need any help, please message the mods [here](http://www.reddit.com/message/compose?to=%2Fr%2Fiama&subject=&message=).  Thank you!   *I am a bot, and this action was performed automatically. Please [contact the moderators of this subreddit](/message/compose/?to=/r/IAmA) if you have any questions or concerns.*#Hi Jag! I'm a student in your EECS 485 class at U of M and have loved the experience. Definitely one of the best courses I've taken at this school!  My question for you: what do you think is the largest problem regarding the anonymization of data on the public dataset releases? Do you think the privacy of those in the data is worth the knock on the information we can retrieve from the datasets? Have you seen an instance where the anonymization of such data has influenced research negatively? Thanks, see you in class!! #Hi Professor, thank you for the AMA!   What would you say are some of the dangers of predictive analytics? How does the study of data ethics address some of those dangers and, also, who is responsible for conclusions made by a machine?#Do you see any future for pier to pier VPN encryption for retail sales, voting purposes or any other privacy sensitive transactions?#Good morning professor. Quick background, I am a system engineer for a health care system. My primary job revolves around a proprietary SQL called CCL. My degree is in information systems security and while I was in school one question was always posed. Who owns the data? With data being stored and moved around so much, particularly in the medical field, who is ethically bound to that data? I hope that makes sense. #If you went corporate, which Big Data company would you most want to work for?#Hello professor. For those of us unaware of exactly how machine learning works, could you help (briefly) clarify exactly what people mean when they talk about the ""black box"" and why it is leading to unethical problems?      Thanks!#Hello Professor, greetings from Chile. I currently work as software engeineer for bank systems. What resources would you recommend to really undesrtand the concepts behind Big Data, beyond the tools?#[deleted]#Does any of your research focus on security? For starters is there a practical list of malware and a practical set of algorithms to reverse [Veil](https://www.veil-framework.com/)? Are there any technologies worth re-engineering for sheer complexity of security countermeasures?#is their a future in cyber security/computer science? Potentially will do a degree in it over maths.#[deleted]#Which field would you say ""Big Data"" utilization is most underutilized? #[deleted]#What is your view on religion within the science community? It intrigued me, how more and more people learn about something, they tend to hit a dead end, where we either don't have the technology, or method to advance any further.   Also, favorite weather?#Hi, thanks for doing this AMA.  In your opinion, who is more intrusive, corporations or the government?  How much can corporations actually see of your information, and how much do they see? (e.g. Photos, surreptitiously taken a/v recordings, emails, texts, history, online habits, posting actions on websites such as reddit, etc.)  What do you believe the main purpose of mass surveillance from the US government is? Intimidation? Protection? Power/blackmail?#[deleted]#What does the future look like for an american citizen in terms of data collection and surveillance? Will privacy be allowed to exist?#Dear Professor, is there any industrial application/adaption based on differential privacy?  If yes, could you please give a brevity of the adaption(s)?#What is your opinion of Business anaytics and info systems or MIS degrees. Think they are enough to break into a data science field? Also what is your opinion on R?#What's your favorite soup?"
learnpython;5gfpqd;1480862912.0;/r/learnpython/comments/5gfpqd/what_would_be_a_good_starting_point_for_someone/;What would be a good starting point for someone trying to get their hands dirty with machine learning, neural networks, analysis of big data etc?;I am a visual learner and I have started coding in python by watching youtube videos (sentdex and thenewboston) so I would love to find some videos explaining some neural network algorithm or something. I have watched sentdex's Machine learning with python tutorial but I am not sure if that is helping with what I actually want to learn. I would like to start off by creating a simple chat bot that imitates my style of chatting by feeding it with all my past chats. Or make a program using neural network that can master some simple game. I am not sure how hard these projects are , but I would love to know how I create these programsI have watched several videos about neural networks and machine learning and I have some idea how it works but I am totally lost when they start coding the actual program.  Are there any good videos out there for free which will help me give a kickstart ? Edit : Thanks for all the great suggestions . I checked some of the links and have started with the Google's deep learning course on Udacity as /u/siddharth25 suggested and I hope it gets me somewhere;Try out Google's own course for machine and deep learning with its `Tensorflow` framework. I think it is available on Udacity.#I'd recommend the books over any video. Try to not mind that these have examples in R since statistics has strong history in R, which is where machine learning comes from.  [the intro book](http://www-bcf.usc.edu/~gareth/ISL/)  ---  [the comprehensive book](http://statweb.stanford.edu/~tibs/ElemStatLearn/)  ---  [data sets + projects](https://www.kaggle.com/)#[neuralnetworksanddeeplearning.com](neuralnetworksanddeeplearning.com)   Explains neural networks and deep learning in Python. It's really good, would recommend. #Datacampis apparently pretty good at getting you started I've heard #Neuroph is an excellent Java library for constructing neural networks. NeurophStudio makes it very easy to play around with your ideas. To start with I would recommend this tutorial: http://neuroph.sourceforge.net/tutorials/wines1/WineClassificationUsingNeuralNetworks.html. Yes, it's not Python, but for learning about neural networks in a practical manner it doesn't really matter.  And here is a very short but useful introduction into neural networks: http://www.ai-junkie.com/ann/evolved/nnt1.html#Why do you want to learn about neutral networks? If you are invested in machine learning you need to learn statistics. Learn the main process of machine learning and then learn programming. Try the book python machine learning by raschka. #http://slendermeans.org/pages/will-it-python.html#You can check out this [Practical Machine Learning Tutorial Series](https://pythonprogramming.net/machine-learning-tutorial-python-introduction/).  The course is structured to first teach the theory, then application with something like sklearn, then creating the algorithms in raw, or at least close-to-raw Python so you can truly understand how things work.   The end has deep learning with Python and TensorFlow, covering a typical feed forward / backprop network, otherwise referred to as the multilayer perceptron model, then we cover recurrent neural networks and convolutional neural networks.   Finally, we cover using TFLearn, which a helpful abstraction layer for Tensorflow. #I can tutor you on neural networks through skype. I would also highly recommend Geoffrey Hinton's coursera course on  neural networks. By week three you'll have implemented a vanilla neural network.  #Not a video, unfortunately, but Sebastian Raschka's Machine Learning in Python book sounds like it would be perfect for you. #https://github.com/ZuzooVn/machine-learning-for-software-engineers#prerequisite-knowledge#Recently came across this great intro on the Google Developers YouTube channel: https://www.youtube.com/playlist?list=PLOU2XLYxmsIIuiBfYad6rFYQU_jL2ryal#I think a good place to start with neural networks is this tutorial which covers all the basics and doesn't shy away from the maths (takes it pretty slow though) - http://www.adventuresinmachinelearning.com/neural-networks-tutorial/
Entrepreneur;5hf0ij;1481304247.0;/r/Entrepreneur/comments/5hf0ij/my_favorite_books_of_2016_for_entrepreneurs/;My favorite books of 2016 for Entrepreneurs;"Hi r/entrepreneur,&nbsp After recently joining a startup, I realized I needed to learn a lot of things, and learn them fast. That's why I've gotten heavily into reading. After seeing u/jacobedawson's post in r/startups, I thought I would share my favorites that have come out this year:&nbsp **Ego is the Enemy** by Ryan HolidayA great book that taught me about the dangers of ego, and how it can affect our relationships and our businesses. One of the key lessons was to ignore recognition, and instead to focus on your work because there is always work to be done.&nbsp **Chaos Monkeys: Obscene Fortune and Random Failure in Silicon Valley** by Antonio Garcia MartinezA tell all about what life was like in Silicon Valley during Facebook's growth years. The story shows that luck and hustle are sometimes the biggest factors in keeping a startup successful.&nbsp **Deep Work: Rules for Focused Success in a Distracted World** by Cal NewportCool read about productivity and how to actually work efficiently. Set aside a few hours of the day to just do focused, intense work, and avoid all distractions (we have to avoid distractions because of ""attention residue""). The difference between ""deep work"" from ""shallow work""? Shallow work is what keeps you from getting fired. Deep work is what gets you promoted.&nbsp **Sprint: How to Solve Big Problems and Test New Ideas in Just Five Days** by Jake KnappSprint outlines what to do day-by-day with your team and various exercises to get to a working prototype that gets tested by end-users on the last day of the sprint for feedback. The book is filled with different examples and stories from companies that have used Sprints to develop their product, like Slack.&nbsp **You Can’t be Everywhere** by Marie WiesePublished by Book in a Box, Marie Wiese’s book is a “common sense approach to digital marketing.” While common marketing advice is telling you to focus on SEO, social media and everything else that is the digital marketing landscape, Marie’s advice says to focus on the correct marketing channels instead of spreading your marketing thin.&nbsp **The Art of Startup Fundraising** by Alejandro CremadesThe book is a great introduction for first-time founders into the world of venture capital. Raising money is a 24/7 job for founders, and Alejandro highlights how to build momentum, craft the right pitch, and common mistakes to avoid. &nbsp **Tools of Titans** by Tim Ferriss*Tools of Titans* just came out, but it's been really good so far. The book is a large read, but it’s filled with actionable things and habits that Tim has noticed successful people do, like meditating, journaling and prioritizing sleep. It follows a three-part structure, broken down into healthy, wealthy, and wise.&nbsp **Payoff: The Hidden Logic that Shapes Our Motivations** by Dan ArielyI love Ariely's *Predictably Irrational*. His writing is great and easy to understand. The lessons in this book leave a lot to think about in how we motive ourselves, our employees and our colleagues. Ultimately, it's about human interaction.&nbsp **The Inevitable: Understanding the 12 Technological Forces that Will Shape Our Future** by Kevin KellyThis isn't a book about how technology works, it's a book about how technology is going to impact our lives and the directions and innovations businesses should focus on.&nbsp **Small Data: The Tiny Clues That Uncover Huge Trends** by Martin LindstromA counterintuitive approach to data: instead of focusing on big data, focus on small data like customer habits about where they live, what they like to do and why they do it. These data points will help uncover product/market fit and understand your customers better.&nbsp **The Third Wave: An Entrepreneur’s Vision of the Future** by Steve CaseAnother book similar to *The Inevitable* (similar in that I mean it will help you think strategically about future business ventures). The ""first wave"" was the building of the internet. The ""second wave"" is one we are in with apps like Facebook and Google building on top of the internet. The ""third wave"" is how the internet will integrate into everything in our lives (healthcare, food, etc).&nbsp **Smarter Faster Better: The Secrets of Being Productive in Life and Business** by Charles DuhiggDuhigg also wrote *The Power of Habit*. Lesson learned in this book: Realize that the items on your to-do list are choices, not chores. By realizing that, we stimulate parts of our brain that are responsible for motivation. It’s also important to spin tasks into a meaningful way that aligns with your greater goals.&nbsp **The Subtle Art of Not Giving a F*ck: A Counterintuitive Approach to Living a Good Life** by Mark MansonAs an entrepreneur, it’s important to know what to care about, and sometimes, more importantly, *what not to care about*. By focusing on the right goals and priorities, we forget and don’t stress out about the things outside of our control, and focus on the bigger problems that we can tackle and make our lives better. &nbsp ___I wrote more about these books in [this blog post](http://www.stacklist.com/articles/best-books-entrepreneurs-2016/), but this is a good summary of each of them. I think these are all great reads for entrepreneurs, and I'm always looking for more books to read to add to my list. Would love to hear your recommendations or your thoughts on any of these books.";"Great list! I would add Shoe Dog by Phil Knight to this list.  Phil Knight is the creator of Nike.  The book is refreshingly candid and honest.  It offers countless nuggets of business advice but, more importantly, this book shows that 1) anyone can start a successful business and 2) you can be successful even if there are already established players (Adidas).  #Awesome list! Thanks for the time to build it. As has already been mentioned I would also add Shoe Dog. I would also add ""The Power of Broke."" Say what you will about Daymond John, the idea that money isn't necessarily an advantage and the creativity can come with not having it is spot on. #I've always thought the $100 startup was a great book for my clients. It goes to show you can start a great business for very little if done correctly.  I ignore the silly online businesses that are dime a dozen and read about the physical businesses with physical assets.   The book really helped me understand, you can start a business for cheap and even buy already successful businesses for cheap if you just look in the right places. #Thank you#Surprised there isn't 4 hour work week!  But to make an addition, how to start and grow your subscription box is a good read from Bemmu, a member on this community who owns Candy Japan, although it is a little expensive https://www.amazon.com/How-Start-Grow-Your-Subscription-ebook/dp/B017T2T8EU/ref=sr_1_5?ie=UTF8&qid=1481330324&sr=8-5&keywords=how+to+start+a+subscription you might want to get off his website#Great list.  Here are some other great books that came out this year:   **Daily Stoic by Ryan Holiday** about stoic philosophy   **Originals by Adam Grant** about creativity   **When Breath Becomes Air by Paul Kalanithi** about the meaning of life   **Sapiens: A Brief History of Humankind by Yuval Noah Harari** about the history of the world  #[deleted]#Thank you for this list. I just purchase 2 books mentioned here and in the comments. #Thanks for the list! #Don't forget #askgaryvee! It is a must read, one of the best books of 2016 imo"
