subreddit;id;created_utc;permalink;title;selftext;comments
ethtrader;5hkqr8;1481385587.0;/r/ethtrader/comments/5hkqr8/luxembourg_investigating_the_potential_benefits/;LUXEMBOURG: Investigating the potential benefits of Blockchain to the fund industry;Interview: PIERRE GERARD, CEO, SCORECHAINhttp://www.luxembourgforfinance.com/sites/luxembourgforfinance/files/climate_finance_december_2016.pdf[ *Luxembourg for Finance (LFF) is the Agency for the Development of the Financial Centre. It is a public-private partnership between the Luxembourg Government and the Luxembourg Financial Industry Federation (PROFIL). Founded in 2008, its objective is to develop Luxembourg’s financial services industry and identify new business opportunities* ]SCORECHAIN, [ https://www.scorechain.com/ ] A LUXEMBOURG START-UP WHICH PROVIDES BUSINESSINTELLIGENCE AND BIG DATA FOR BLOCKCHAIN TECHNOLOGIES HAS SETUP A NEW BLOCKCHAIN CONSORTIUM COMPRISING TEN KEY PLAYERSOF THE LUXEMBOURG FUND INDUSTRY. THE AIM IS TO EXPLORE THEPOTENTIAL OF BLOCKCHAIN TECHNOLOGY TO IMPROVE EFFICIENCYAND CREATE NEW BUSINESS OPPORTUNITIES IN THE ASSET MANAGEMENTINDUSTRY.> LFF: WHO ARE YOUR PARTNERS IN> LUXEMBOURG AND HOW ARE THEY> CONTRIBUTING TO THIS PROCESS?> PG: We have already 11 participants, nine> “pure players” from the industry (**BIL,> BNP Paribas, CACEIS, European Fund> Administration, HSBC, ING Luxembourg,> Pictet, RBC Investor & Treasury Services, Société Générale Bank & Trust), PwC> and SnT, University of Luxembourg**. We> have to discuss how we could integrate> newcomers in 2017. We have organised> several pieces of training, workshops and> even a two-day hackathon with 80> participants with business and technical> teams.> > **As a result, we have already a prototype> running on Ethereum and have fascinating feedback**. We are working directly with> the participant's technical teams, so we are> already studying how these new developments will integrate into their infrastructure.;Asset Management. Its not really how I pictured the world computer being used a year ago, but it is quickly becoming the dominant use case on the network. And honestly, it is a huge use case. If the regulatory hurdles can start to be overcome, I could see this kind of usage basically taking over the entire network.
bigdata;5h6hzc;1481197627.0;/r/bigdata/comments/5h6hzc/top_big_data_skills_to_future_proof_your_career/;Top Big Data Skills To Future Proof Your Career – Become A Data Engineer Now;;The list of things you should know.  1.SQL(Structured  Query Language):  2.Python Programming:  3.Java Programming:  4.R programming:  5.SAS(Statistical Analysis System):  6.Apache Hadoop:  7.Apache Hive:  8.MapReduce:  9.Apache Pig:  10.Apache Spark:  11.Data Visualization:  12.NoSQL: #~~Server not found~~  It's back.
farming;5ivpqt;1481998205.0;/r/farming/comments/5ivpqt/automation_ai_machine_learning/;Automation, AI, Machine Learning?;[deleted];This question probably better suited for r/engineering#[deleted]#Can't help you out on books so much. But I recommend looking for something along the lines of beginner PLC programming and HMI integration. I'm an automation engineer and the old man got out of pigs before I got into this.  Kinda bummed now cause automating the barn would have been would have been a fun project.  #There's a free Stanford Uni course on Coursera on Machine Learning:    https://www.coursera.org/learn/machine-learning  or ask the ML subreddit: https://www.reddit.com/r/MachineLearning/
buildapc;5jf8zb;1482262585.0;/r/buildapc/comments/5jf8zb/big_data_desktop_computer_build_for_under_4000/;Big Data Desktop Computer Build for under $4000;"###Build Help/Ready:Hi, I'm a machine learning engineer and I'm trying to figure out the best build for a personal computer to go with for processing mounds of data. I do a lot of distributed computing using tools like Hadoop and Spark, and am trying to get a machine that does a lot of the work on GPU's, rather than CPU's I'm currently using due to the speed increase you get. My typical processing job uses anything from a measly few MB's to some TB's worth of data(stored on external seagate hard drives via usb3.0 ports). OS doesn't matter, I use both Linux and Windows so either works. -------------------------------------------------------------------------------------------------I was given an idea by user /u/amazn_azn with these specs: -Intel Core i7-6800K 3.4GHz 6-Core Processor,-Corsair H110i GTX 104.7 CFM Liquid CPU Cooler,-ASRock X99 Taichi ATX LGA2011-3 Motherboard,-Corsair Vengeance LED 64GB (4 x 16GB) DDR4-3200 Memory,-Samsung 850 EVO-Series 500GB 2.5"" Solid State Drive,-Toshiba X300 5TB 3.5"" 7200RPM Internal Hard Drive,-Asus GeForce GTX 1080 8GB STRIX Video Card (2-Way SLI),-Asus GeForce GTX 1080 8GB STRIX Video Card (2-Way SLI),-Corsair 750D ATX Full Tower Case,-EVGA 1000W 80+ Platinum Certified Fully-Modular ATX Power Supply,-Microsoft Windows 10 Pro OEM 64-bit------------------------------------------------------------------I had a similar build that I based off a CyberPowerPC pre-built machine(Fang III - Black Mamba) that I further customized. The specs were:-Intel Core i7-6850K 3.6Ghz 6-core CPU,-XSPC raystorm d5 photon ax 360mm watercooler kit,-ASUS rog x99 rampage v extreme motherboard,-Corsair Vengeance LED 64GB (4 x 16GB) DDR4-3200 Memory,-512GB intel ssd 660p series PCIe NVMe M.2 SSD,-2x2TB 72000RPM SATA-III HDD,-2XGeForce GTX 1080 8GB GDDR5X Video Card (2-Way SLI),-Corsair Obsidian 900D Super Tower Gaming Case w/ Dual PSU Support,-1,000 Watts - Standard 80 Plus Gold Power Supply,-Windows 10 Pro --------------------------------------------------------------------------Just wondering if anyone has some recommendations or alterations for a pc build that would fit some of the requirements without killing the price range. Thanks for the help!";"To take advantage of the GPU (CUDA), you'd need to re-write your program to do so. AFAIK, there's no out-of-the-box config that makes it ""just work"".  Hadoop is relatively simple to scale out horizontally (more machines). You might achieve better performance with multiple mid-range systems, than 1 single high-end system.  NVMe drives will be a good investment as the basis for what you deploy your HDFS on.   Don't work from spinning HDDs. They should act as storage only. HDDs are really bad at random and parallel access. SSDs are great at random access and NVMe are particularly good are parallel access on top of that.  If you're caught between multiple CPU choices, you'd want the want that has the highest **multithreaded score**, that's affordable to you.  Try with a single 1080 first and see how that pans out. For GPGPU purposes, you do not need an SLI bridge (I think).  You can even consider going [Dual-Xeons with slightly older parts](http://www.techspot.com/review/1218-affordable-40-thread-xeon-monster-pc/page4.html).  [edit] As many of said, the Titan XP would be better suited than a GTX 1080 for GPGPU usage.#Thanks for the help everyone, I appreciate it! One other question I have is when buying a custom pc for the first time, is it better to buy all the parts and build yourself? or rather use a website that builds it for you and sends it? I'd be comfortable putting everything together, but the one thing that would worry me is applying the cooling system to the CPU. I've heard you have to watch out for air-pockets, and a whole sort of different things when applying it that could end up destroying the cpu if not applied correctly. Any reccomendations on that?#http://www.slideshare.net/PetteriTeikariPhD/deep-learning-workstation#Not entirely sure about this, but would you be opposed to buying one Titan XP instead of two 1080s? I don't know anything about machine learning or anything but I do know that SLI doesn't really scale that well."
Buttcoin;5hewzb;1481303255.0;/r/Buttcoin/comments/5hewzb/oh_dear_cftc_commissioner_j_christopher_giancarlo/;oh dear, CFTC Commissioner J. Christopher Giancarlo swallows the Blockchain(tm) hype whole;http://www.cftc.gov/PressRoom/SpeechesTestimony/opagiancarlo-18This has been all over the financial press today. Many noted that he was suggesting not harshly regulating Blockchain(tm). Here's what he said:>The first challenge comes from exponential digital technologies that are rapidly changing the very nature of human identity, work, leisure and society. These breaking digital innovations include automated algorithmic trading that has transformed trading markets, distributed ledger technology, more commonly known as blockchain, “big data” capability for sophisticated data analysis and interpretation, artificial intelligence guiding highly dynamic trade execution and “smart” contracts that value themselves and calculate payments in real-time. Today, I want to discuss automated electronic trading, distributed ledger technology and digital data analysis.and a whole section where he elaborates on this content-free bafflegab. Sigh.;"Surely this is good for Buttcoin.#There's nothing we can do; we must wait for the disease to run its course.#That's big news. The CFTC tends to be even _more_ pedantic and anal about securities laws than the SEC. The CFTC was the first organization that wanted to regulate derivatives trading in the 90s. The SEC and the Treasury blocked them. If they had been allowed to, we might not have seen the 2008 crisis.  SFYL and comedy gold futures UP UP UP, I guess we might not see more Buttcoin regulation anytime soon!#Future historians will be looking on reddit archives examining the debates of blocksize, and sidechains, and the development and progress of Bitcoin's future.  Snapshots:  1. *This Post* - [archive.org](https://web.archive.org/20161209170911/http://www.reddit.com/r/Buttcoin/comments/5hewzb/oh_dear_cftc_commissioner_j_christopher_giancarlo/), [megalodon.jp](http://megalodon.jp/2016-1210-0209-11/www.reddit.com/r/Buttcoin/comments/5hewzb/oh_dear_cftc_commissioner_j_christopher_giancarlo/), [ceddit.com](http://www.ceddit.com//r/Buttcoin/comments/5hewzb/oh_dear_cftc_commissioner_j_christopher_giancarlo/), [_archive.is\*_](https://archive.is/?url=http%3A%2F%2Fwww.reddit.com%2Fr%2FButtcoin%2Fcomments%2F5hewzb%2Foh_dear_cftc_commissioner_j_christopher_giancarlo%2F&run=1 ""could not auto-archive; click to resubmit it!"")  2. http://www.cftc.gov/PressRoom/Speec... - [archive.org](https://web.archive.org/20161209170920/http://www.cftc.gov/PressRoom/SpeechesTestimony/opagiancarlo-18), [megalodon.jp](http://megalodon.jp/2016-1210-0209-22/www.cftc.gov/PressRoom/SpeechesTestimony/opagiancarlo-18), [_archive.is\*_](https://archive.is/?url=http%3A%2F%2Fwww.cftc.gov%2FPressRoom%2FSpeechesTestimony%2Fopagiancarlo-18&run=1 ""could not auto-archive; click to resubmit it!"")  *^(I am a bot.) ^\([*Info*](/r/SnapshillBot) ^/ ^[*Contact*](/message/compose?to=\/r\/SnapshillBot))*#What is this shit? What is the buttcoin foundation paying this guy for? Seriously low quality shill work."
denverjobs;5gh89z;1480880519.0;/r/denverjobs/comments/5gh89z/hiring_multiple_technical_positions_cloud_c_java/;[Hiring] Multiple technical positions (cloud, c#, Java, angular, practice leadership) at all levels;"I help lead one of the technical practices at Slalom Consulting here in Denver. For those who don't know who Slalom is, we have ~4500 employees in 25 offices in the US, Canada and the UK. We are more than just a technical consulting company, we have 7 different practices here in Denver including standard management consulting, delivery leadership, big data, software engineering, design, etc. We're privately held, never grow through acquisition, and try to live up to our core values (which haven't changed and are actionable (https://www.slalom.com/core-values). We have a local model where our consultants live and work in their home market. We have a few travelers, but that is by choice not by definition. We have roughly 175 people in the denver office across all of the practices. In the technology space, we're tech agnostic. We have partnerships with most of the big players (our big 4 are aws, Microsoft, Salesforce, and Tableau) but they don't dictate to us nor do we push their products unless it's what's right (see core value #1). I'm working at a client that's fully in the IBM stack for example. We align our technical folks along the tech they like, and don't ask them to be a generalist (unless they like to be). This means if you're an ios dev, we're not going to ask you to write java or c# code. That just doesn't make sense does it? Right now, we have a pretty pressing need for a large number of people as we head into 2017.  We'll be hiring throughout the year, so if the time isn't right, don't hesitate to reach out. In a nutshell, here's what our current needs look like:- full stack engineers Some sort of Javascript framework (preference to angular or react), c# or Java backend, node/go/Python is acceptable too depending on level/balance. Multiple positions, 1-2 years of experience to architect - front end engineerstypically angular 1.x right now, obviously react is big tooWe need 2-5 engineers, from 1-2 years experience to architect. - Java engineersWe need an architect level fullish stack Java engineer,  and a couple strong junior to mid level engineers. Services mostly, rarely jsp type work. - c# engineers We need a couple junior to mid level c# engineers. Services, mvc, sorry no webforms or vb. - AWS engineers/architects We need 3-5 people ranging from 1-2 years experience to well seasoned architects. Bonus points for automation/devops, especially on the application build side, not just the IaaS side. PaaS side also very helpful. We have massive backing by aws in the market so these are key roles (again, tech agnostic, but we're seeing very, very heavy volume from clients to rearchitect their applications to take advantage of the cloud) - practice leadership It's very hard to hire us. Basically we're going to look for folks who have lead other consulting practices or owned an agency/consulting company. You must be the right mix of business, relationship, and technical - again, hard to find. We normally grow from within (and are), but having external leaders come in (like I did) from time to time can be a great boost. If you don't feel like you fit into any of the above ""buckets"" no sweat. We love diversity (in all the senses), so reach out. Definitions like the above are there to help center people. If you're interested, shoot me a pm and we'll go from there. A few important notes:- sorry, no recruiters - if you're from out of town, great! You will need to, during the interview process, come to Denver for an in person interview- we also don't offer relocation as a general rule. Since I (and an employeee who worked for me in Dallas went through this last year, I can help walk you through it). - our interview process is a little lengthy. Our biggest asset is our people, and we get great clients who ask us back because of our ability to deliver and our great people. We need to make sure that the individuals we hire fit our culture. - if you you have no work experience in any of the above, and this includes going through a boot camp (galvanize, etc), sorry you won't be a great fit. Honestly we're not setup organizationally (yet) to support zero experience analysts. ";Ooh, I'm looking for a junior(ish) C# dev position in the Front Range area.  Looks like this https://www.slalom.com/job-opportunity-denver-net-developer would be the one I'm looking for. Any others I should apply for?#Sent you a PM. What's the best way to send you a resume?
bigdata;5gpy11;1480987218.0;/r/bigdata/comments/5gpy11/is_big_data_here_to_stay/;Is big data here to stay?;Trying to do a double major in statistics and computer science. Also trying to learn SQL, python and machine learning during my spare time. However will the field of data science, big data, etc... Still be in demand in the next 5ish years?;"Of course it will! The name will change. The techniques will change. Languages will come and go. But the ""core idea"" isn't going anywhere.  More companies are dealing with more data than ever. Whether it's pharmaceutical clinical trials, sales receipts, stock purchase transactions, transportation fleet tracking, or whatever else may come, volume, velocity, and variability will continue to increase. And once you have all of that data, what do you do with it? How do you turn historical data into future value? That question isn't going anywhere. #No, the last time I've head the industry standard is going to be changed to 100 observations per model with a huge fine should you use more data #It's still one of the fastest growing fields and if history tells us, its only going to be in more demand since the data we produce is expanding at an exponential rate (think IoT devices). And with all the automation going on in little data jobs, it is quite safe to be in big data/data science."
GradSchool;5joke0;1482380103.0;/r/GradSchool/comments/5joke0/would_i_qualifybe_ready_for_a_masters_in/;Would I qualify/be ready for a Masters in Statistics;Hello guys,I'm looking for some opinions on whether or not I'd qualify for a Graduate program in Statistics. To give a little background, my bachelors is in interactive media art and engineering. I initially came at it from the B.A. side, focusing on UX design and 2d/3d graphics. However, there was the option to come at it from the B.S. side of things in computer science. Over the last 2 years I began taking more cs and math courses. While it's impractical to transition over to the cs degree at this point, by the time I graduate I will have taken cs coursework in Algorithms and Data Structures, Discrete Math, Object Oriented Programming, Probability and Statistics Engineering, Software Engineering and Calc I - III. I did this partly because I was worried about job security and also because I wasn't dead-set on a single field and wanted to have more transferable skills. I don't plan to apply for graduate school immediately. I want to narrow down my interest - I rushed into college without much self-reflection. But of the Masters degree's that I've considered the only one that ever really stood out was a Masters in Statistics. Marketing Analytics, Big Data and Data Science all sound up my alley. Regardless, would the background I have in Computer Science and Math be enough to get me in the door at a grad school, or would I be too far behind for it to be practical?I'd also like to hear from any people who went the Statistics route and what you've worked on both in and out of the classroom.Thanks for any info!;Have you taken a linear algebra class? Some proof-y math classes may help you as well, but it sounds like your interests lie more in applied statistics.#If you're going for an MS in Statistics rather than an MS in Applied Statistics, you should at least have Calc I-III (needed for Mathematical Statistics theory) and Linear Algebra (needed for regression). I really wish I'd taken more Linear Algebra with how often it comes up in upper level classes. Differential equations would be useful for Poisson proof. Also, if you can take a 400 level Stat class, such as Intro to Math Stats, you'll be much more prepared for the Mathematical Statistics theory classes you usually get in your first year.#I guess it depends on the program, but I think you have a good chance. (Source: am first year master's student in statistics. I came from a B.S. in psychology. This semester was rough for multiple reasons and I wish I would've done a few things differently, but professors generally consider me a good student. If I could scrape through, so can you. Just don't try to take too many credits at once--there should be no need to anyway.)
Surface;5gtpos;1481041010.0;/r/Surface/comments/5gtpos/sp4_vs_sb/;SP4 vs SB;Hi everyone. I've been using a S3 (2gb version) for about a year and a half now as my primary computer and most of the time it works great. The issue I run into is that I just do not have enough power. I work as a research analyst and although sometimes the work is simple enough for the S3 to handle, there have been plenty of times that I need to wait until I'm at work to use my desktop (8gb ram) to do anything because the load is just to big. So I'm considering getting a S4 or SB as my new primary computer. I don't need it immediately, but in the next year or so I anticipate buying one. So what do you guys think? Is the SB overkill or statistical modeling and analysis with big data sets? Would the extra power be worth it? Or will the SP4 be good enough? Also, is the SB worth the price increase over the SP4 in general? ;To me it basically comes down to if you need the additional graphics power that the Surface Book has. Everything else is pretty much shared between the two of them.#I am also a  research analyst  and also just upgraded from the Surface 3 2gb model to the M3 for work .  I think the surfacebook is overkill for the work we do but at the same time, I think it has a better form factor then the surface pro 4.   #You will most likely find the performance of the SP4 to be enough for that kind of modelling (I do with my old SP3).  I think it comes down to what kind of use and versatility you want in a device really. SP is closer to a tablet (or pretty much a beefed up version of your current device) while SB is closer to a laptop.  While I was a student SP was perfect since I was more mobile, now that I sit in an office or travel in work I'd rather go for the SB. #They're pretty much the same computer except one has a slightly better dedicated video card. If your workload is CPU bound then the Surface Book would not give you any extra performance. In fact, the SP4 would provide a much better value, for example:  ---  SP4 - i7 16GB 256GB is only $1600  versus  SB - i5 8GB 256GB dGPU is $1649  ---  So unless you need the dGPU then other factors might be more important, battery life, keyboard, display size, lapability, tablet hinge, etc. It's more of a personal choice.  Keep in mind the dGPU in the SB isn't really seamless like a desktop PC. By default applications use the intel video chip unless you specifically configure a specific application to use the nvidia card. You cannot detach the display if an app is running and configured to use the nvidia chip (it will prompt you to shut down the app). So 90% of the time, I'm using the onboard Intel chip even in drawing programs.#The easiest way to decide I feel is this:  Do you need the extra power dGPU?  * If yes, then get the SB  If no, then we'll go to the next question:  Do you prefer a tablet first or laptop first experience? Ie. would you take advantage of a tablet form factor more or a laptop form factor more?  * If laptop first, then the SB * If tablet first, then the SP4#I don't have that kind of workload to do on a SP3, but I'm waiting for the SP5.  If you can wait a year or so, I imagine a version of the SP5 with enough ram and the new intel processors that could probably handle a fair bit of processing requirements.#Even if you don't need the extra power of the surfacebook GPU, consider the much longer battery life. realistic best case scenario on sp4 is 5-6 hours, on surfacebook it is literally 10-12 hrs... I've flip flopped back and forth between SB and SP4 too many times now, right now I'm on the SurfaceBook, and I definitely enjoy not being OCD about the charge level of my device, I can literally wait 2-3 days before worrying about charging the SurfaceBook, since my usage model is 2-3 hours a day on the machine. (This might be different if you use the detached clipboard mode a lot though as clipboard runs out of battery fairly quickly if it is off the base)#Performance wise, unless you use CUDA enabled applications where the GPU would give you a performance benefit, the SB and SP4 are pretty much identical in terms of performance. Choose the device that makes the most sense for your workflow. Do you want a tablet that can also function as a laptop, or do you want a laptop that can work as a tablet?
worldevents;5joee2;1482377792.0;/r/worldevents/comments/5joee2/big_data_and_government_chinas_digital/;Big data and government: China’s digital dictatorship -- Worrying experiments with a new form of social control;;
